{
  "$schema": "https://json-schema.org/draft/2020-12/schema",
  "$id": "ai-task.schema.json",
  "title": "Archify code-analysis AI optimization task",
  "description": "A brief for a coding agent, built from one analysis snapshot (findings.json + raw-facts.json) by lib/task.mjs. Detected facts, possible impact and suggested directions are kept apart; anything the project does not state is listed under toConfirm. The Markdown export renders this object.",
  "type": "object",
  "additionalProperties": false,
  "required": ["schema_version", "kind", "taskId", "title", "findings", "source", "locations", "facts", "impact", "suggestions", "scope", "preserve", "acceptance", "verification", "toConfirm", "evidence", "instructions"],
  "$defs": {
    "sha": { "type": "string", "pattern": "^[0-9a-f]{64}$" },
    "findingId": { "type": "string", "pattern": "^[A-Z]{2,4}-(?:[0-9a-f]{12}|[0-9]{4,})$" },
    "status": { "enum": ["captured", "valid", "changed", "missing", "unverifiable"] },
    "segment": {
      "type": "object",
      "additionalProperties": false,
      "required": ["startLine", "endLine", "lines"],
      "properties": {
        "startLine": { "type": "integer", "minimum": 1 },
        "endLine": { "type": "integer", "minimum": 1 },
        "lines": { "type": "array", "items": { "type": "string" } }
      }
    }
  },
  "properties": {
    "schema_version": { "const": 1 },
    "kind": { "const": "archify-code-analysis-task" },
    "taskId": { "type": "string", "pattern": "^TASK-[0-9a-f]{12}$", "description": "Hash of the finding ids and their evidence digests: the same findings with the same evidence give the same id." },
    "title": { "type": "string", "minLength": 1 },
    "findings": {
      "type": "array",
      "minItems": 1,
      "items": {
        "type": "object",
        "additionalProperties": false,
        "required": ["id", "code", "dimension", "severity", "confidence"],
        "properties": {
          "id": { "$ref": "#/$defs/findingId" },
          "code": { "type": "string" },
          "dimension": { "type": "string" },
          "severity": { "enum": ["error", "warning", "info"] },
          "confidence": { "type": "number" },
          "review": { "type": "object", "description": "Baseline / comparison status from review.json, when known." },
          "evidenceDigest": { "type": "object", "required": ["files", "sha256"], "properties": { "files": { "type": "array", "items": { "type": "string" } }, "lines": { "type": "array", "items": { "type": "integer" } }, "sha256": { "$ref": "#/$defs/sha" } } }
        }
      }
    },
    "source": {
      "type": "object",
      "additionalProperties": false,
      "required": ["root", "language", "adapter", "sourceKind", "snapshotId", "configDigest", "analyzer", "gitHead"],
      "properties": {
        "root": { "type": ["string", "null"], "description": "Analyzed directory relative to the Git root; never an absolute path." },
        "language": { "type": ["string", "null"] },
        "adapter": { "type": ["string", "null"] },
        "sourceKind": { "type": ["string", "null"] },
        "snapshotId": { "type": ["string", "null"] },
        "configDigest": { "type": ["string", "null"] },
        "analyzer": { "type": ["object", "null"] },
        "gitHead": { "type": ["string", "null"], "description": "Context only; the analyzed text is the working tree." }
      }
    },
    "locations": {
      "type": "array",
      "items": {
        "type": "object",
        "additionalProperties": false,
        "required": ["findingId", "file", "kind", "sha256", "excerpt"],
        "properties": {
          "findingId": { "$ref": "#/$defs/findingId" },
          "file": { "type": "string", "minLength": 1 },
          "kind": { "enum": ["function", "import", "range", "file"] },
          "startLine": { "type": "integer", "minimum": 1 },
          "endLine": { "type": "integer", "minimum": 1 },
          "symbol": { "type": "string" },
          "focusLine": { "type": "integer", "minimum": 1, "description": "For a function: the line of its deepest nesting." },
          "capturedOccurrences": { "type": "integer", "minimum": 2, "description": "Present when the cited lines occur more than once in the captured file; a match elsewhere is then ambiguous, not a move." },
          "note": { "type": "string" },
          "sha256": { "oneOf": [{ "$ref": "#/$defs/sha" }, { "type": "null" }], "description": "Hash of lines startLine..endLine joined with \\n; null when the text was not captured or there is no range." },
          "excerpt": {
            "oneOf": [{ "type": "null" }, {
              "type": "object",
              "additionalProperties": false,
              "required": ["segments", "omitted", "complete"],
              "properties": {
                "segments": { "type": "array", "minItems": 1, "items": { "$ref": "#/$defs/segment" } },
                "omitted": { "type": "array", "items": { "type": "object", "additionalProperties": false, "required": ["startLine", "endLine"], "properties": { "startLine": { "type": "integer" }, "endLine": { "type": "integer" } } } },
                "complete": { "type": "boolean", "description": "false when lines inside the location were left out of the excerpt." }
              }
            }]
          },
          "status": { "$ref": "#/$defs/status", "description": "Set by evidence verification." },
          "currentStartLine": { "type": "integer", "minimum": 1, "description": "Where the unchanged range is now, when it moved." },
          "currentEndLine": { "type": "integer", "minimum": 1 },
          "reason": { "type": "string" }
        }
      }
    },
    "facts": { "type": "array", "items": { "type": "object", "additionalProperties": false, "required": ["findingId", "statement", "evidence"], "properties": { "findingId": { "$ref": "#/$defs/findingId" }, "statement": { "type": "string" }, "evidence": { "type": "object" } } } },
    "impact": { "type": "array", "items": { "type": "object", "additionalProperties": false, "required": ["findingId", "statement"], "properties": { "findingId": { "$ref": "#/$defs/findingId" }, "statement": { "type": "string" } } } },
    "suggestions": { "type": "array", "description": "Directions to evaluate, from the rule's supportedFixes; not confirmed defects.", "items": { "type": "object", "additionalProperties": false, "required": ["findingId", "text"], "properties": { "findingId": { "$ref": "#/$defs/findingId" }, "text": { "type": "string" } } } },
    "scope": { "type": "object", "additionalProperties": false, "required": ["modify", "read", "note"], "properties": { "modify": { "type": "array", "items": { "type": "string" }, "description": "Files with cited lines: where the change is expected." }, "read": { "type": "array", "items": { "type": "string" }, "description": "Other files the finding was computed from, for context." }, "note": { "type": "string" } } },
    "preserve": { "type": "array", "items": { "type": "string" } },
    "acceptance": { "type": "array", "items": { "type": "string" } },
    "verification": {
      "type": "object",
      "additionalProperties": false,
      "required": ["reanalyze", "commands"],
      "properties": {
        "reanalyze": { "type": "object", "additionalProperties": false, "required": ["command", "purpose"], "properties": { "command": { "type": "string" }, "purpose": { "type": "string" } } },
        "commands": { "type": "array", "items": { "type": "object", "additionalProperties": false, "required": ["command", "purpose", "source"], "properties": { "command": { "type": "string" }, "purpose": { "type": "string" }, "source": { "type": "string" } } } }
      }
    },
    "toConfirm": { "type": "array", "items": { "type": "string" } },
    "evidence": {
      "type": "object",
      "additionalProperties": false,
      "required": ["status", "checkedAt", "reason"],
      "properties": {
        "status": { "$ref": "#/$defs/status" },
        "checkedAt": { "type": ["string", "null"], "description": "ISO time of the last check against the working tree; null when only captured." },
        "reason": { "type": ["string", "null"] },
        "findings": { "type": "object", "description": "Per finding id: { status, reason, digestMatches }.", "additionalProperties": { "type": "object", "required": ["status"], "properties": { "status": { "$ref": "#/$defs/status" }, "reason": { "type": "string" }, "digestMatches": { "type": ["boolean", "null"] } } } }
      }
    },
    "instructions": { "type": "array", "minItems": 1, "items": { "type": "string" } }
  }
}
